{
  "format": "KITABA_UPDATE",
  "protocol_version": 1,
  "campaign_id": "11111111-1111-4111-8111-111111111111",
  "timeline_id": "22222222-2222-4222-8222-222222222222",
  "update_id": "33333333-3333-4333-8333-333333333333",
  "base_revision": 0,
  "target_revision": 1,
  "game_time": {"set": "Day 1 08:00", "elapsed_minutes": 0},
  "operations": [
    {
      "op": "create",
      "entity_type": "player_character",
      "entity_id": "44444444-4444-4444-8444-444444444444",
      "data": {"first_name": "Sully", "species": "Human", "age": 8}
    }
  ],
  "gm_operations": [],
  "journal_entries": [],
  "notifications": [],
  "checkpoint": null,
  "death": null
}
